{
  "contractId": "insight.knowledge-source-manifest",
  "schemaVersion": "1.0.0",
  "scope": "INS-009",
  "status": "accepted",
  "profile": {
    "jurisdiction": "US",
    "releaseUse": "research-only",
    "clinicalDeploymentAllowed": false
  },
  "authorityPolicy": {
    "sourceUpdatesAutoActivate": false,
    "preserveOriginalClinicianValues": true,
    "unresolvedTermsRemainVisible": true,
    "missingOrStaleSourceBehavior": "block-affected-output",
    "historicalResultsRetainPinnedSources": true
  },
  "sources": [
    {
      "domain": "formulary",
      "authorityStatus": "not-applicable",
      "authorityName": null,
      "publisher": null,
      "sourceUrl": null,
      "pinnedVersion": null,
      "licenseStatus": "not-applicable",
      "allowedResearchUse": false,
      "decision": "INSIGHT does not make formulary, coverage, reimbursement, stock, or local availability claims."
    },
    {
      "domain": "medication-dosing",
      "authorityStatus": "selected",
      "authorityName": "FDA-approved product labeling indexed by Drugs@FDA",
      "publisher": "US Food and Drug Administration",
      "sourceUrl": "https://www.fda.gov/drugs/drug-approvals-and-databases/drugsfda-data-files",
      "pinnedVersion": "snapshot-2026-07-28",
      "licenseStatus": "public-us-government-source",
      "allowedResearchUse": true,
      "decision": "Only product-specific labeled dosing may be represented; unsupported products or uses remain explicit."
    },
    {
      "domain": "medication-contraindications",
      "authorityStatus": "selected",
      "authorityName": "FDA-approved product labeling indexed by Drugs@FDA",
      "publisher": "US Food and Drug Administration",
      "sourceUrl": "https://www.fda.gov/drugs/drug-approvals-and-databases/drugsfda-data-files",
      "pinnedVersion": "snapshot-2026-07-28",
      "licenseStatus": "public-us-government-source",
      "allowedResearchUse": true,
      "decision": "Only product-specific labeled contraindications may be represented; absent evidence is unknown, not no contraindication."
    },
    {
      "domain": "medication-monitoring",
      "authorityStatus": "selected",
      "authorityName": "FDA-approved product labeling indexed by Drugs@FDA",
      "publisher": "US Food and Drug Administration",
      "sourceUrl": "https://www.fda.gov/drugs/drug-approvals-and-databases/drugsfda-data-files",
      "pinnedVersion": "snapshot-2026-07-28",
      "licenseStatus": "public-us-government-source",
      "allowedResearchUse": true,
      "decision": "Only product-specific labeled monitoring may be represented; absent evidence is unknown, not no monitoring required."
    },
    {
      "domain": "diagnosis-terminology",
      "authorityStatus": "selected",
      "authorityName": "ICD-10-CM",
      "publisher": "US Centers for Disease Control and Prevention, National Center for Health Statistics",
      "sourceUrl": "https://www.cdc.gov/nchs/icd/icd-10-cm/files.html",
      "pinnedVersion": "2026",
      "licenseStatus": "public-us-government-source",
      "allowedResearchUse": true,
      "decision": "ICD-10-CM supplies diagnosis terminology and codes only; psychiatrist confirmation remains authoritative."
    },
    {
      "domain": "medication-terminology",
      "authorityStatus": "selected",
      "authorityName": "RxNorm Current Prescribable Content Full Monthly Release",
      "publisher": "US National Library of Medicine",
      "sourceUrl": "https://www.nlm.nih.gov/research/umls/rxnorm/docs/rxnormfiles.html",
      "pinnedVersion": "2026-07-06",
      "licenseStatus": "no-license-required-release",
      "allowedResearchUse": true,
      "decision": "RxNorm identifiers normalize medications; ambiguous and unknown matches remain unresolved."
    }
  ],
  "requiredProvenance": [
    "authority-domain",
    "authority-name",
    "source-version",
    "source-record-identifier",
    "source-document-date",
    "source-url",
    "retrieved-at",
    "source-sha256"
  ],
  "updateCadence": {
    "drugsAtFda": {
      "checkSchedule": "weekdays",
      "maximumUncheckedDays": 3
    },
    "rxNorm": {
      "checkSchedule": "weekly",
      "maximumUncheckedDays": 8
    },
    "icd10cm": {
      "checkSchedule": "every-30-days",
      "maximumUncheckedDays": 31
    },
    "governanceReviewIntervalDays": 90,
    "changeRequiresValidation": true,
    "changeRequiresClinicalReview": true,
    "overdueBehavior": "block-affected-output"
  },
  "observableBlockedCase": {
    "state": "knowledge-authority-blocked",
    "code": "KNOWLEDGE_AUTHORITY_UNAVAILABLE",
    "includeFailedDomains": true,
    "includeSourceVersion": true,
    "includeResolutionActions": true,
    "authoritativeClinicalClaimAllowed": false
  },
  "releaseGate": {
    "state": "blocked",
    "blockedBy": [
      "clinical-deployment-not-approved",
      "named-clinical-owner-signoff-missing",
      "named-pharmacy-owner-signoff-missing",
      "source-ingestion-not-implemented",
      "source-validation-not-implemented"
    ]
  }
}
